TaskId,TaskDesc
128,You have subscribed to a new gym but you forgot to write down the business hours. Now you would like to find their page on of the social media apps and find their business hours.
129,Consider your favorite brand of handbags. You have saved a lot of money to buy one and would like to see what kind of bag trends prople are posting about. Or you may want to check people's opinion about different models on their social media. Search for it.
130,You are interested to know about the top hits of 2017 to listen to. Try to find them.
131,"You are looking for an app that would help you live a healthier life. You want to find one with a program that you could customize, as well as easy to follow instructions."
132,"You have applied for a job that requires you to solve a coding challenge before the interview. It has been a few days since they sent me the link to the challenge, so you need to find the email for the challenge."
133,Consider your favorite app you use to search for locations. What was your latest local search query?
134,You would like to watch the latest video clip of your favorite singer.
135,You recently heard that newspaper jobs are dropping because of the rise of electronic media. Now you are curious to learn more. Find information about the effect of electronic media on the traditional newspaper industry.
136,You recently watched a news report about a human stampede at a sporting event that left several people dead. Now you are curious about how often something like this happens. Find information about instances where a human stampede has resulted in a substantial number of injured and dead.
137,Consider an airline that you have never flown with before. You are going to fly with this airline next month. Issue a query that would help you find important information regarding the airline's luggage policies.
138,Imagine you saw an article about a very local small town. Now you would like to see the whole thing. How would you search for that?
139,You are looking for a kid friendly cafe in my area and need a lunch diner with a good kids menu.
140,Consider a type of clothing you would want to buy for your child. You may want to take into account some details that your care for while searching for it. Search for it on an online store.
141,Imagine you have purchased a flight ticket for a business trip. Tomorrow is your flight and so you need to find more details about your flight. How would you search and find the relevant information?
142,"Select some apps for location search. Try to think of a query which would help you find some relevant information about a location. You can think of one your previous experiences while you were searching for a location and type the query here. Please remember, we do not need any description of your situation, we are interested in the queries you used."
143,Imagine you use your email as the primary form of communication. A while ago you received an email with some warranty information in it and want to check the status of a delivery. How would you search for it?
144,"Imagine for Christmas, you wanted to give yourself something a bit quirky. you wanted something that was beautiful, portable, and a bit odd. Think of something that you would buy for yourself and search for it to order it online."
145,"You are interested in getting rid of cable TV. If you are aware of any device that would help you with that, try to order it online. Otherwise, try to get some information on what would be suitable."
146,Search for a cheap but decent cable for your phone to order online.
147,Imagine last week you arranged a meeting with your boss and wrote it on the calendar app you use on your phone. Now you remember that the event should be tomorrow but cannot recall more details. Search for this event.
148,"Assume you work as a children's librarian. Today, you need to find out how to make fancier versions of a paper airplane to show some of the kids in a program. You are looking for videos that are easy to follow and don't require too many steps. Search for some how-to videos."
149,You are looking for a new roommate to share your apartment with. You are trying to reuse an old ad for your vacant room. So you need to find the images of the apartment and the ad links so that you don't have to go through the stress of recreating the vacant room posts.
150,Imagine you had a conversation with your best friend last week about an upcoming event in downtown. It was about a music festival but you cannot recall more details. How would you search to get more information about this event in your town?
151,Imagine you are actually bored with what is on TV and would like to look around on to see what is recommended. Then you would like to search for a couple of videos about the type of car you drive to get an idea about how to perform a couple of maintenance tasks.
152,Imagine recently your cat is sick and you are looking for emergency veterinarians. It is a weekend evening and your regular veterinarian isn't open until Monday. How would you search for a place to take care of your cat?
153,Search for one of the latest free race games to install on your phone.
154,Consider you or one of the people you know who regularly does a specific sport. You would like to buy something that would be useful for you or the person who does the sport. It can be anything related to that sport. Try to find something to order online.
155,"Consider your latest purchase. As all of us usually do, we compare different offers to make sure we are having a good deal. How would you search for that item to see different offers and compare prices?"
156,"You are working on a group project in grad school. You have a working document that you and your group each need to update, and, as it needs to be in a .docx format, you need to email it back and forth. In a team meeting, you try to find the latest version of the document."
157,"Consider one of your favorite pastries. It's been a while since you have been thinking of baking it once. So, it would be a good idea to find some recipes and check Instagram to see how people make it."
158,Today you heard an old song on the radio while you were driving back home. It reminded you of your childhood when you used to listen to it more often. You cannot remember the singer or the song's name. Try to find it.
159,Recently you purchased a pair of pants online. You need to find the receipt to return the pair of pants for a refund since they do not fit you.
160,"You are writing a research paper about the relations between Iran and Iraq. You want to find instances where the two countries have worked together for a common goal. Find information about instances where Iran and Iraq have cooperated for a common economic, military, religious, or social objective."
161,"Recently you have heard interesting stories about investing in silver coins and collecting them. Search for videos on Silver coin collecting, metal detecting etc., and why silver (ag) is a good investment."
162,Your 3 year old flushed a small squishy snowman down the toilet and the toilet was spewing water from the bottom of the toilet. Of course you don't want to pay a plumber so you are trying to figure out how to get it out.
163,You are trying to make banana bread and want to find a good recipe that is also gluten-free.
164,Search the latest updates on the MeToo campaign.
165,Consider the apps you usually use to manage your notes or files. What was your latest file or note search query on your smartphone?
166,Consider your favorite social media platform. You would like to change your profile picture on it. Issue a query that would help you find an appropriate picture of you.
167,"Consider one of your personal belongings such as a watch, bracelet, sunglasses, notebook, etc. is now worn out or you do not like it anymore. Maybe because you don't like something about it. Now you want to change it and need to search for a better item to order online. "
168,Consider your favorite app you use to search for videos. What was your latest video search query on your smartphone?
169,"Select some apps where you manage your files. What would you search using them? Write the query you would use. This can be anything. It would be better if you can think of your recent experience when you were trying to find something in those apps. Please remember, we do not need any description of your situation, we are interested in the queries you used."
170,Is iPhone X better or Samsung Galaxy S8? Issue a query that would help you find some videos comparing these phones with respect to the factors you care about most.
171,"Consider one of your oldest personal belongings. Now you would like to change it. If you are happy with the brand, it might be a good idea to buy from the same company. If not, you may want to look for another brand."
172,You are en rout flying to a city far from your hometown. You need to search for your itinerary to see your stops and stop times.
173,Get directions to the nearest hospital to your current location.
174,"A couple of weeks ago, while putting together a musical program for your church's Christmas Eve service, you realized you didn't have a good way of exactly timing each piece. Search for an app that would help you."
175,"Consider of your friends who has moved to a new state. You would like to check their latest updates on their social media profiles but you do not have their profile. So, search for their social media profile."
176,You are in hurry and need to get a taxi to home. Find a taxi.
177,You are searching for an app to help you get cash back from my online purchases to help you save your money in the long term.
178,Imagine you received an email from your teacher last week related to one of your courses. Issue a query that would help you find the email from your teacher which contained an attachment related to your course.
179,You were recently watching a U.S. news channel that is often accused of being biased. Now you are wondering whether similar biases occur in other countries around the world. Find information about the types of media biases in news channels outside the U.S.
180,"You recently heard that voter turnout in the last presidential election was about 60%, which is not unusual. You are surprised that voter turnout is so low and are wondering why. Find information about the reasons for poor turnout in U.S. elections."
181,Consider your favorite TV show. You don't know many people around you who like it. You want to check Twitter to see what people are saying about it and what their fan theories are.
182,"Imagine you are trying to renew your favorite worn out shoes. So, it should be your same favorite brand and model. Try to find it."
183,Imagine you are at a burger restaurant and notice an advertisement offering a free entree (with purchase of side and drink) if you download their app. Search for it.
184,One of your friends in Canada just went on a five-month long maternity leave. This made you curious about different maternity leave policies around the world. Find information about the maternity leave policies from different governments around the world.
185,Imagine you received an email from your best friend a while ago. Now you cannot find that email but you remember that a PDF file was attached to it. Formulate a query that would help you find the email.
186,"You found a box in your storage room which was an old (unused, unopened) set of chef's knives etc. from Emeril Lagasse. You thought to sell it on eBay, and so you need to find some images of it on the Internet so you could put the image on eBay."
187,You like to see how people from different parts of the world have celebrated the new year. You may be looking for some pictures or videos on some social media apps. Search for it.
188,"Imagine you are going for a job interview that involves selling meat to restaurants and in order to prepare, you needed to study an image of the cuts of beef and pork. How would you find relevant information?"
189,Imagine you have been busy with work for the past week and only had Christmas Day as a day off. You have been working from early in the day until night time every day for a week prior and had run out of a few essential items that you needed to purchase. You know that most retail locations are closed on major holidays so you need to find one that is open right now.
190,Consider one of the latest movies on theater. Issue a query that would help you find the trailer of that movie.
191,You want to contact the landscape designer who worked on a redo of your lawn and patio two years ago. You want her to come out before the holidays because you have planned to buy two Italian cypress trees instead of a cut Christmas tree. You remember that we had chatted about the landscape plan via email and that the last email you received from her was in April 2015. You went back to that point in time and couldn't find her email. Try to search for it.
192,Imagine you need to get directions to your friend's house from your work and you have little time.
193,"Imagine it has become quite difficult for you to remember when to water your plants because now you have more than 20 of them. That is why you tell yourself, there must be an app that would remind you when to water them. Search for an app that would help you."
194,The birthday invitation for the party organized by your kid's school was sent electronically yesterday and you cannot remember the address. Now you need to find the address.
195,"Select some apps for video search. What would you search using them? Write the query you would use. This can be anything. It would be better if you can think of your recent experience when you were trying to find something in those apps. Please remember, we do not need any description of your situation, we are interested in the queries you used."
196,You do a lot of cooking outdoors on the barbecue and it is difficult for you to keep track of the amount of time items have been on the grill. Search for an app that would allow you to run several timers at the same time.
197,"Imagine a few days ago you heard a song on the radio when riding home, and weren't sure who the singer was. How would you find the song? Think of some sample queries."
198,You just found out that a local grocery store had started an app that coincides with their current rewards program. Search for it.
199,Consider one of the items you have in your bathroom. Imagine you just broke it and need to change it. Search for it to order online.
200,Select some apps where you usually keep your notes. Think of something you would need in your notes and search for it.
201,Assume tonight you are going to have dinner with your best friend. Issue a query that would help you find a decent restaurant serving your favorite food and your best friend's favorite food.
202,Select some social media apps. What would you search on them? Write the query you would use.
203,"A couple of days ago you bought a very good used computer and brought it home. Yesterday you realized that there was no socket for your old mechanical keyboard to plug in. So, now you need to fix this problem. Search for it."
204,"Consider the next book that you would like to read and try to order it online. If you don't have any idea what to read next, try to search for your favorite type of books to get some ideas."
205,Search for video tutorial on how to make pasta.
